Title,Author,Link,Sinopsis,Genre
"A History of Religious Ideas, Volume 1: From the Stone Age to the Eleusinian Mysteries",Mircea Eliade,https://www.goodreads.com/book/show/778581.A_History_of_Religious_Ideas_Volume_1,"Les trois tomes de l Histoire des croyances et des ides religieuses - De lge de la pierre aux mystres dEleusis (1975), De Gautama Bouddha au triomphe du christianisme (1978) et De Mahomet lge des Rformes (1983) - reprsentent une uvre irremplaable. Lrudition et la puissance intellectuelle synthtique de Mircea Eliade apportent au lecteur une vision des religions qui fait apparatre la fois lunit fondamentale des phnomnes religieux et linpuisable nouveaut de leurs expressions selon sa formule. Le tome I nous conduit des premiers comportements magico-religieux des hommes prhistoriques lpanouissement du culte de Dionysos, travers les religions msopotamiennes et de lEgypte ancienne, la religion dIsral, la religion des Indos-Europens, les religions de lInde avant Bouddha, la religion grecque et la religion iranienne.",Religion
الرحيق المختوم,Safiur Rahman Mubarakpuri,https://www.goodreads.com/book/show/545425._,. . . . . . . 24713962371976 -,Religion
Caim,José Saramago,https://www.goodreads.com/book/show/7011225-caim,"Neste novo romance, o vencedor do prmio Nobel Jos Saramago reconta episdios bblicos do Velho Testamento sob o ponto de vista de Caim, que, depois de assassinar seu irmo, trava um incomum acordo com deus e parte numa jornada que o levar do jardim do den aos mais recnditos confins da criao.Se, em O Evangelho segundo Jesus Cristo, Jos Saramago nos deu sua viso do Novo Testamento, neste Caim ele se volta aos primeiros livros da Bblia, do den ao dilvio, imprimindo ao Antigo Testamento a msica e o humor refinado que marcam sua obra. Num itinerrio heterodoxo, Saramago percorre cidades decadentes e estbulos, palcios de tiranos e campos de batalha, conforme o leitor acompanha uma guerra secular, e de certo modo involuntria, entre criador e criatura. No trajeto, o leitor revisitar episdios bblicos conhecidos, mas sob uma perspectiva inteiramente diferente.Para atravessar esse caminho rido, um deus s turras com a prpria administrao colocar Caim, assassino do irmo Abel e primognito de Ado e Eva, num altivo jegue, e caber dupla encontrar o rumo entre as armadilhas do tempo que insistem em atra-los. A Caim, que leva a marca do senhor na testa e portanto est protegido das iniquidades do homem, resta aceitar o destino amargo e compactuar com o criador, a quem no reserva o melhor dos julgamentos. Tal como o diabo de O Evangelho, o deus que o leitor encontra aqui no o habitual dos sermes ao reinventar o Antigo Testamento, Saramago recria tambm seus principais protagonistas, dando a eles uma roupagem ao mesmo tempo complexa e irnica, cujo tom de farsa da narrativa s faz por acentuar.",Religion
Living Wicca: A Further Guide for the Solitary Practitioner,Scott Cunningham,https://www.goodreads.com/book/show/145564.Living_Wicca,"Librarian note an alternate cover for this edition can be found here.Unesposizione puntuale e concisa dei fondamenti della wicca per i lettori di ogni et, desiderosi di avvicinarsi a questa religione neopagana. I devoti della Dea e del Dio, uomini e donne accomunati dalla medesima fede, potranno approfondire la conoscenza teorico-pratica della magia delle Streghe wiccan. Scott Cunningham con questa guida si rivolge a un pubblico di iniziati ai quali viene offerta loccasione di addentrarsi nel magico mondo della wicca per potenziare le proprie facolt occulte e celebrare individualmente cerimonie e riti di grande potere.",Religion
The Last Letter,Rebecca Yarros,https://www.goodreads.com/book/show/40045986-the-last-letter,"Kann ein gebrochenes Herz lernen, wieder zu lieben?Ella htte nie gedacht, dass sie als Brieffreundin eines anonymen Soldaten in diesem einen wahren Freund finden wrde. Dennoch entwickelt sich eine tiefe Zuneigung zwischen ihr und Chaos vielleicht sogar mehr. Dann treffen Ella mehrere schwere Schicksalsschlge und als auch die Briefe von Chaos ausbleiben, muss sie glauben, dass sie allein auf der Welt ist.Obwohl er sie nicht persnlich kennt, hat Beckett alias Chaos sich in die Frau hinter den Briefen verliebt. Ella, die Schwester seines besten Freundes. Als dieser stirbt, bittet er Beckett in einem letzten Brief, Ella beizustehen. Beckett wird alles tun, um Ella zu untersttzen, aber er wird ihr niemals sagen knnen, wer er wirklich ist, und Ella hasst nichts mehr als Lgen.",Romance
Saphirblau,Kerstin Gier,https://www.goodreads.com/book/show/6919272-saphirblau,"Frisch verliebt in die Vergangenheit, das ist vielleicht keine gute Idee. Das zumindest findet Gwendolyn, 16 Jahre alt, frisch gebackene Zeitreisende. Schlielich haben sie und Gideon ganz andere Probleme. Zum Beispiel die Welt zu retten. Oder Menuett tanzen zu lernen. (Beides nicht wirklich einfach!)Als Gideon dann auch noch anfngt, sich vllig rtselhaft zu benehmen, wird Gwendolyn klar, dass sie schleunigst ihre Hormone in den Griff bekommen muss. Denn sonst wird das nichts mit der Liebe zwischen allen Zeiten!",Romance
Smaragdgrün,Kerstin Gier,https://www.goodreads.com/book/show/7544603-smaragdgr-n,"Gwendolyn ist am Boden zerstrt. War Gideons Liebesgestndnis nur eine Farce, um ihrem groen Gegenspieler, dem dsteren Graf von Saint Germain, in die Hnde zu spielen? Fast sieht es fr die junge Zeitreisende so aus. Doch dann geschieht etwas Unfassbares, das Gwennys Weltbild einmal mehr auf den Kopf stellt. Fr sie und Gideon beginnt eine atemberaubende Flucht in die Vergangenheit. Rauschende Ballnchte und wilde Verfolgungsjagden erwarten die Heldin wider Willen und ber allem steht die Frage, ob man ein gebrochenes Herz wirklich heilen kann ...",Romance
King's Cage,Victoria Aveyard,https://www.goodreads.com/book/show/35072205-king-s-cage,"Jadilah saksi atas tawanan ini, atas pertanda kemenangan ini!Ini dia Mare Barrow, pemimpin Barisan Merah. Seorang Pembunuh, teroris, musuh besar kerajaan kita. Dan, sekarang, dia berlutut di hadapan kita.Darahnya yang mengucur menjadi bukti akan identitasnya.Gadis berkekuatan petir dari Kaum MerahMare Barrowtertangkap saat memberontak dan ditahan dalam sangkar cantik Kerajaan Norta. Maven, sang Raja Kaum Perak, terobsesi membalas dendam kepadanya. Dia menjadikan Mare boneka yang tak berdaya menolak perintahnya.Namun, pemberontakan belum selesai. Percobaan pembunuhan terhadap sang Raja terjadi dan perang pun berkobar. Mare diselamatkan. Kini dia harus berlatih keras untuk menyempurnakan kekuatannya demi pertarungan puncak nanti. Di tengah situasi yang semakin panas, hubungan Mare dengan CalPangeran Perak yang terbuangpun semakin dalam.Perang menjanjikan dimulainya Era Baru. Namun, benarkah semua perbedaan bisa bersatu dan perdamaian bisa tercipta? Bagaimana jika untuk mencapai itu semua, Mare harus melepaskan hal terpenting dalam hidupnya?",Romance
